{
  "format_version": 1,
  "name": "ensemble-proposers",
  "kind": "ensemble",
  "description": "Three parallel proposers draft concrete solutions for the same spec so a downstream implementer builds from a pre-digested draft.",
  "config": {
    "prompt_template": "Draft a complete solution for this spec. Be concrete and specific — an implementer downstream may build directly from your draft without ever seeing this spec itself, so leave nothing implicit:\n\n{{spec_content}}\n\nPrevious feedback (if any): {{previous_feedback}}",
    "members": [
      {},
      {},
      {}
    ]
  }
}
